{
  "schema_version": "1.0",
  "component": "DSG.RepositoryKnowledgeGraph",
  "authority": "projection",
  "generated_at_utc": "2026-09-22T08:45:00Z",
  "entities": [
    {
      "id": "ADR-019",
      "type": "adr",
      "title": "External Retrospective Scientific Records",
      "status": "Owner-approved profile; private real record admitted; public activation pending",
      "authority": "repository_authority",
      "source_locator": {
        "path": "docs/architecture/ADR-019-External-Retrospective-Scientific-Records.md"
      }
    },
    {
      "id": "AP-001",
      "type": "architecture_package",
      "title": "Enterprise Metamodel and Repository Information Architecture",
      "status": "completed",
      "authority": "repository_authority",
      "source_locator": {
        "path": ".github/roadmap/roadmap-source.json"
      }
    },
    {
      "id": "AP-002",
      "type": "architecture_package",
      "title": "Enterprise Data Governance",
      "status": "completed",
      "authority": "repository_authority",
      "source_locator": {
        "path": ".github/roadmap/roadmap-source.json"
      }
    },
    {
      "id": "AP-003",
      "type": "architecture_package",
      "title": "Observatory Automation Architecture",
      "status": "completed",
      "authority": "repository_authority",
      "source_locator": {
        "path": ".github/roadmap/roadmap-source.json"
      }
    },
    {
      "id": "AP-004",
      "type": "architecture_package",
      "title": "Enterprise Telemetry and Observability Architecture",
      "status": "completed",
      "authority": "repository_authority",
      "source_locator": {
        "path": ".github/roadmap/roadmap-source.json"
      }
    },
    {
      "id": "AP-005",
      "type": "architecture_package",
      "title": "Identity, Access and Remote Operations Security",
      "status": "completed",
      "authority": "repository_authority",
      "source_locator": {
        "path": ".github/roadmap/roadmap-source.json"
      }
    },
    {
      "id": "AP-006",
      "type": "architecture_package",
      "title": "Enterprise Configuration and Asset Management",
      "status": "completed",
      "authority": "repository_authority",
      "source_locator": {
        "path": ".github/roadmap/roadmap-source.json"
      }
    },
    {
      "id": "AP-007",
      "type": "architecture_package",
      "title": "Enterprise Operations and Service Management Architecture",
      "status": "active",
      "authority": "repository_authority",
      "source_locator": {
        "path": ".github/roadmap/roadmap-source.json"
      }
    },
    {
      "id": "AP-008",
      "type": "architecture_package",
      "title": "Enterprise Integration Architecture",
      "status": "active",
      "authority": "repository_authority",
      "source_locator": {
        "path": ".github/roadmap/roadmap-source.json"
      }
    },
    {
      "id": "AP-009",
      "type": "architecture_package",
      "title": "Enterprise Infrastructure Architecture",
      "status": "completed",
      "authority": "repository_authority",
      "source_locator": {
        "path": ".github/roadmap/roadmap-source.json"
      }
    },
    {
      "id": "AP-010",
      "type": "architecture_package",
      "title": "Enterprise Safety Assurance Architecture",
      "status": "completed",
      "authority": "repository_authority",
      "source_locator": {
        "path": ".github/roadmap/roadmap-source.json"
      }
    },
    {
      "id": "AP-011",
      "type": "architecture_package",
      "title": "Enterprise Analytics Platform Architecture",
      "status": "completed",
      "authority": "repository_authority",
      "source_locator": {
        "path": ".github/roadmap/roadmap-source.json"
      }
    },
    {
      "id": "AP-012",
      "type": "architecture_package",
      "title": "Enterprise Operations Center Architecture",
      "status": "completed",
      "authority": "repository_authority",
      "source_locator": {
        "path": ".github/roadmap/roadmap-source.json"
      }
    },
    {
      "id": "AP-013",
      "type": "architecture_package",
      "title": "Scientific Image Repository Architecture",
      "status": "completed",
      "authority": "repository_authority",
      "source_locator": {
        "path": ".github/roadmap/roadmap-source.json"
      }
    },
    {
      "id": "AP-013C",
      "type": "architecture_package",
      "title": "Verified Transport Cleanup and Convergence Monitoring",
      "status": "Approved with Conditions",
      "authority": "repository_authority",
      "source_locator": {
        "path": "docs/architecture/traceability-register.md"
      }
    },
    {
      "id": "AP-014",
      "type": "architecture_package",
      "title": "Scientific Observation Catalog and Search",
      "status": "completed",
      "authority": "repository_authority",
      "source_locator": {
        "path": ".github/roadmap/roadmap-source.json"
      }
    },
    {
      "id": "AP-015",
      "type": "architecture_package",
      "title": "Scientific Knowledge Platform Architecture",
      "status": "Accepted / Post-Merge Verified",
      "authority": "repository_authority",
      "source_locator": {
        "path": ".github/roadmap/roadmap-source.json"
      }
    },
    {
      "id": "ADR-001",
      "type": "adr",
      "title": "Session Layer",
      "status": "Accepted",
      "authority": "repository_authority",
      "source_locator": {
        "path": "docs/architecture/ADR-001-Session-Layer.md"
      }
    },
    {
      "id": "ADR-002",
      "type": "adr",
      "title": "Analytics Quality Gates",
      "status": "Accepted",
      "authority": "repository_authority",
      "source_locator": {
        "path": "docs/architecture/ADR-002-Analytics-Quality-Gates.md"
      }
    },
    {
      "id": "ADR-003",
      "type": "adr",
      "title": "Warehouse Engine",
      "status": "Accepted",
      "authority": "repository_authority",
      "source_locator": {
        "path": "docs/architecture/ADR-003-Warehouse-Engine.md"
      }
    },
    {
      "id": "ADR-004",
      "type": "adr",
      "title": "Operational Architecture",
      "status": "Accepted",
      "authority": "repository_authority",
      "source_locator": {
        "path": "docs/architecture/assessments/ADR-004-Operational-Architecture.md"
      }
    },
    {
      "id": "ADR-005",
      "type": "adr",
      "title": "Weather Safety Interlock fail-safe",
      "status": "Accepted with Conditions",
      "authority": "repository_authority",
      "source_locator": {
        "path": "docs/architecture/ADR-005-Weather-Safety-Interlock.md"
      }
    },
    {
      "id": "ADR-006",
      "type": "adr",
      "title": "Enterprise Plugin SDK",
      "status": "Accepted",
      "authority": "repository_authority",
      "source_locator": {
        "path": "docs/architecture/ADR-006-Enterprise-Plugin-SDK.md"
      }
    },
    {
      "id": "ADR-007",
      "type": "adr",
      "title": "SQM Instrument Source Strategy",
      "status": "Accepted / Post-Merge Verified",
      "authority": "repository_authority",
      "source_locator": {
        "path": "docs/architecture/ADR-007-SQM-Instrument-Source-Strategy.md"
      }
    },
    {
      "id": "ADR-008",
      "type": "adr",
      "title": "PixInsight Provenance Capture Strategy",
      "status": "Accepted / Post-Merge Verified",
      "authority": "repository_authority",
      "source_locator": {
        "path": "docs/architecture/ADR-008-PixInsight-Provenance-Capture-Strategy.md"
      }
    },
    {
      "id": "ADR-009",
      "type": "adr",
      "title": "GitHub-Governed Setup Authority",
      "status": "Accepted",
      "authority": "repository_authority",
      "source_locator": {
        "path": "docs/architecture/ADR-009-GitHub-Governed-Setup-Authority.md"
      }
    },
    {
      "id": "ADR-010",
      "type": "adr",
      "title": "Ephemeris and Lunar Method and Validation Profile",
      "status": "Accepted",
      "authority": "repository_authority",
      "source_locator": {
        "path": "docs/architecture/ADR-010-Ephemeris-Lunar-Method-and-Validation-Profile.md"
      }
    },
    {
      "id": "ADR-011",
      "type": "adr",
      "title": "Forecast Source and Run Lineage",
      "status": "Accepted",
      "authority": "repository_authority",
      "source_locator": {
        "path": "docs/architecture/ADR-011-Forecast-Source-and-Run-Lineage.md"
      }
    },
    {
      "id": "ADR-012",
      "type": "adr",
      "title": "MeteoHub Recurring Forecast Supply",
      "status": "Owner-Authorized / Implementation Candidate",
      "authority": "repository_authority",
      "source_locator": {
        "path": "docs/architecture/ADR-012-MeteoHub-Recurring-Forecast-Supply.md"
      }
    },
    {
      "id": "ADR-013",
      "type": "adr",
      "title": "Session Readiness / Go-No-Go Boundary",
      "status": "Accepted with Conditions",
      "authority": "repository_authority",
      "source_locator": {
        "path": "docs/architecture/ADR-013-Session-Readiness-Go-No-Go-Boundary.md"
      }
    },
    {
      "id": "ADR-014",
      "type": "adr",
      "title": "Observatory Health Score Boundary",
      "status": "Proposed",
      "authority": "repository_authority",
      "source_locator": {
        "path": "docs/architecture/ADR-014-Observatory-Health-Score-Boundary.md"
      }
    },
    {
      "id": "ADR-015",
      "type": "adr",
      "title": "BKL-036 Source Mapping and Evidence Compatibility Boundary",
      "status": "Accepted / Post-Merge Verified",
      "authority": "repository_authority",
      "source_locator": {
        "path": "docs/architecture/ADR-015-BKL-036-Source-Mapping-and-Evidence-Compatibility-Boundary.md"
      }
    },
    {
      "id": "BKL-036",
      "type": "backlog_item",
      "title": "Observatory Health Score",
      "status": "Done",
      "authority": "repository_authority",